<?xml version="1.0" encoding="UTF-8"?>
<data xmlns:xsi="http://www.w3.org/2001/XMLSchema-instance" xsi:noNamespaceSchemaLocation="WildTalentsCharacterCreator.xsd" version="1" cost_willpower="1" cost_willpower_base="3">
  <!-- 
    Notes 
    * all elements have a
      * id _ unique identifier, optional
      * ref_ reference for lookups, can have duplicates, optional
      * name _ display name, optional
    * ref or id used when linking elements together
    * cost for stats and skills doesn't include Native modifier 
  -->
  <pools>
    <!--
        Stats
      -->
    <pool type="stat" name="Body">
      <effect type="stat" name="Body" ref="body" cost="4"/>
    </pool>
    <pool type="stat" name="Coordination">
      <effect type="stat" name="Coordination" ref="coordination" cost="4"/>
    </pool>
    <pool type="stat" name="Sense">
      <effect type="stat" name="Sense" ref="sense" cost="4"/>
    </pool>
    <pool type="stat" name="Mind">
      <effect type="stat" name="Mind" ref="mind" cost="4"/>
    </pool>
    <pool type="stat" name="Charm">
      <effect type="stat" name="Charm" ref="charm" cost="4"/>
    </pool>
    <pool type="stat" name="Command">
      <effect type="stat" name="Command" ref="command" cost="4"/>
    </pool>
    <!--
        Skills, starting with custom ones
      -->
    <pool type="skill" name="Custom Standard Skill">
      <effect type="skill" cost="1" name="Custom Standard Skill" source="WT2E"/>
    </pool>
    <pool type="skill" name="Custom Build Skill">
      <effect type="skill" cost="0" name="Custom Build Skill" source="WT2E"/>
    </pool>
    <!-- Wild Talent Skills -->
    <pool type="skill" name="">
      <effect type="skill" cost="1" name="Athletics" link="body" is_note_required="true" source="WT2E"/>
    </pool>
    <pool type="skill" name="">
      <effect type="skill" cost="1" name="Block" link="body" source="WT2E"/>
    </pool>
    <pool type="skill" name="">
      <effect type="skill" cost="1" name="Brawling" link="body" source="WT2E"/>
    </pool>
    <pool type="skill" name="">
      <effect type="skill" cost="1" name="Endurance" link="body" source="WT2E"/>
    </pool>
    <pool type="skill" name="">
      <effect type="skill" cost="1" name="Melee Weapon" link="body" is_note_required="true" source="WT2E"/>
    </pool>
    <pool type="skill" name="">
      <effect type="skill" cost="1" name="Dodge" link="coordination" source="WT2E"/>
    </pool>
    <pool type="skill" name="">
      <effect type="skill" cost="1" name="Driving" link="coordination" is_note_required="true" source="WT2E"/>
    </pool>
    <pool type="skill" name="">
      <effect type="skill" cost="1" name="Ranged Weapon" link="coordination" is_note_required="true" source="WT2E"/>
    </pool>
    <pool type="skill" name="">
      <effect type="skill" cost="1" name="Stealth" link="coordination" source="WT2E"/>
    </pool>
    <pool type="skill" name="">
      <effect type="skill" cost="1" name="Empathy" link="sense" source="WT2E"/>
    </pool>
    <pool type="skill" name="">
      <effect type="skill" cost="1" name="Perception" link="sense" source="WT2E"/>
    </pool>
    <pool type="skill" name="">
      <effect type="skill" cost="1" name="Scrutiny" link="sense" source="WT2E"/>
    </pool>
    <pool type="skill" name="">
      <effect type="skill" cost="1" name="First Aid" link="mind" source="WT2E"/>
    </pool>
    <pool type="skill" name="">
      <effect type="skill" cost="1" name="Knowledge" link="mind" is_note_required="true" source="WT2E"/>
    </pool>
    <pool type="skill" name="">
      <effect type="skill" cost="1" name="Language" link="mind" is_note_required="true" source="WT2E"/>
    </pool>
    <pool type="skill" name="">
      <effect type="skill" cost="1" name="Medicine" link="mind" source="WT2E"/>
    </pool>
    <pool type="skill" name="">
      <effect type="skill" cost="1" name="Navigation" link="mind" source="WT2E"/>
    </pool>
    <pool type="skill" name="">
      <effect type="skill" cost="1" name="Research" link="mind" source="WT2E"/>
    </pool>
    <pool type="skill" name="">
      <effect type="skill" cost="1" name="Security Systems" link="mind" source="WT2E"/>
    </pool>
    <pool type="skill" name="">
      <effect type="skill" cost="1" name="Streetwise" link="mind" source="WT2E"/>
    </pool>
    <pool type="skill" name="">
      <effect type="skill" cost="1" name="Survival" link="mind" source="WT2E"/>
    </pool>
    <pool type="skill" name="">
      <effect type="skill" cost="1" name="Tatics" link="mind" source="WT2E"/>
    </pool>
    <pool type="skill" name="">
      <effect type="skill" cost="1" name="Lie" link="charm" source="WT2E"/>
    </pool>
    <pool type="skill" name="">
      <effect type="skill" cost="1" name="Performance" link="charm" is_note_required="true" source="WT2E"/>
    </pool>
    <pool type="skill" name="">
      <effect type="skill" cost="1" name="Persuasion" link="charm" source="WT2E"/>
    </pool>
    <pool type="skill" name="">
      <effect type="skill" cost="1" name="Interrogation" link="command" source="WT2E"/>
    </pool>
    <pool type="skill" name="">
      <effect type="skill" cost="1" name="Intimidation" link="command" source="WT2E"/>
    </pool>
    <pool type="skill" name="">
      <effect type="skill" cost="1" name="Leadership" link="command" source="WT2E"/>
    </pool>
    <pool type="skill" name="">
      <effect type="skill" cost="1" name="Stability" link="command" source="WT2E"/>
    </pool>
    <!-- Basic Skills KC -->
    <pool type="skill" name="">
      <effect type="skill" cost="0" name="Boxing" link="body" source="KC"/>
    </pool>
    <pool type="skill" name="">
      <effect type="skill" cost="0" name="Lifting" link="body" source="KC"/>
    </pool>
    <pool type="skill" name="">
      <effect type="skill" cost="0" name="Running" link="body" source="KC"/>
    </pool>
    <pool type="skill" name="">
      <effect type="skill" cost="0" name="Sports" link="body" source="KC"/>
    </pool>
    <pool type="skill" name="">
      <effect type="skill" cost="0" name="Wrestling" link="body" source="KC"/>
    </pool>
    <pool type="skill" name="">
      <effect type="skill" cost="0" name="Acrobatics" link="coordination" source="KC"/>
    </pool>
    <pool type="skill" name="">
      <effect type="skill" cost="0" name="Archery" link="coordination" source="KC"/>
    </pool>
    <pool type="skill" name="">
      <effect type="skill" cost="0" name="Climb" link="coordination" source="KC"/>
    </pool>
    <pool type="skill" name="">
      <effect type="skill" cost="0" name="Dodge" link="coordination" source="KC"/>
    </pool>
    <pool type="skill" name="">
      <effect type="skill" cost="0" name="Evasion" link="coordination" source="KC"/>
    </pool>
    <pool type="skill" name="">
      <effect type="skill" cost="0" name="Horsemanship" link="coordination" source="KC"/>
    </pool>
    <pool type="skill" name="">
      <effect type="skill" cost="0" name="Pistol" link="coordination" source="KC"/>
    </pool>
    <pool type="skill" name="">
      <effect type="skill" cost="0" name="Rifle" link="coordination" source="KC"/>
    </pool>
    <pool type="skill" name="">
      <effect type="skill" cost="0" name="Empathy" link="sense" source="KC"/>
    </pool>
    <pool type="skill" name="">
      <effect type="skill" cost="0" name="Hear" link="sense" source="KC"/>
    </pool>
    <pool type="skill" name="">
      <effect type="skill" cost="0" name="Notice" link="sense" source="KC"/>
    </pool>
    <pool type="skill" name="">
      <effect type="skill" cost="0" name="Reflexes" link="sense" source="KC"/>
    </pool>
    <pool type="skill" name="">
      <effect type="skill" cost="0" name="Search" link="sense" source="KC"/>
    </pool>
    <pool type="skill" name="">
      <effect type="skill" cost="0" name="See" link="sense" source="KC"/>
    </pool>
    <pool type="skill" name="">
      <effect type="skill" cost="0" name="Smell" link="sense" source="KC"/>
    </pool>
    <pool type="skill" name="">
      <effect type="skill" cost="0" name="Taste" link="sense" source="KC"/>
    </pool>
    <pool type="skill" name="">
      <effect type="skill" cost="0" name="Touch" link="sense" source="KC"/>
    </pool>
    <pool type="skill" name="">
      <effect type="skill" cost="0" name="Track" link="sense" source="KC"/>
    </pool>
    <pool type="skill" name="">
      <effect type="skill" cost="0" name="A Single Academic Field" link="mind" is_note_required="true" source="KC"/>
    </pool>
    <pool type="skill" name="">
      <effect type="skill" cost="0" name="A Language" link="mind" is_note_required="true" source="KC"/>
    </pool>
    <pool type="skill" name="">
      <effect type="skill" cost="0" name="Act" link="command" source="KC"/>
    </pool>
    <pool type="skill" name="">
      <effect type="skill" cost="0" name="Intimidate" link="command" source="KC"/>
    </pool>
    <pool type="skill" name="">
      <effect type="skill" cost="0" name="Lie" link="command" source="KC"/>
    </pool>
    <pool type="skill" name="">
      <effect type="skill" cost="0" name="Stability" link="command" source="KC"/>
    </pool>
    <pool type="skill" name="">
      <effect type="skill" cost="0" name="Bluff" link="charm" source="KC"/>
    </pool>
    <pool type="skill" name="">
      <effect type="skill" cost="0" name="Feign" link="charm" source="KC"/>
    </pool>
    <pool type="skill" name="">
      <effect type="skill" cost="0" name="Innocence" link="charm" source="KC"/>
    </pool>
    <pool type="skill" name="">
      <effect type="skill" cost="0" name="Lie" link="charm" source="KC"/>
    </pool>
    <pool type="skill" name="">
      <effect type="skill" cost="0" name="Seduce" link="charm" source="KC"/>
    </pool>
    <!-- Advanced Skills KC -->
    <pool type="skill" name="">
      <effect type="skill" cost="0" name="Athletics" link="body" source="KC">
        <modifier type="skill" name="Broad" cost="1"/>
      </effect>
    </pool>